{
  "schema": "activity/v1",
  "id": "count.ladybugs.6",
  "review": "needs-editor",
  "revision": 1,
  "template": "count_tap",
  "templateVersion": "1.0",
  "domain": "numbers",
  "band": "A",
  "skills": [
    {
      "id": "NUM-A-09",
      "weight": 1
    },
    {
      "id": "NUM-A-03",
      "weight": 0.6
    }
  ],
  "purpose": "learn",
  "checkType": "practice",
  "representation": "concrete",
  "variantGroup": "count-tap",
  "difficulty": {
    "authored": 0.4
  },
  "prompt": {
    "vo": "vo:count.ladybugs.6.prompt",
    "caption": [
      {
        "t": "he",
        "v": "נוֹגְעִים בְּכׇל אֶחָד פַּעַם אַחַת, וְסוֹפְרִים."
      }
    ],
    "replayButton": true
  },
  "scene": {
    "background": "asset:meadow",
    "objects": {
      "sprite": "asset:ladybug",
      "litSprite": "asset:ladybug_lit",
      "count": 6,
      "arrangement": "scatter",
      "onTap": "glow",
      "seed": 21
    },
    "target": {
      "sprite": "asset:basket_target"
    }
  },
  "answer": {
    "type": "choice",
    "options": [
      {
        "id": "o1",
        "value": 5,
        "misconception": "M-CNT-SKIP"
      },
      {
        "id": "o2",
        "value": 6
      },
      {
        "id": "o3",
        "value": 7,
        "misconception": "M-CNT-DOUBLE"
      }
    ],
    "correct": "o2",
    "shuffle": false,
    "unsureAllowed": true
  },
  "answerPrompt": {
    "vo": "vo:count.ladybugs.6.how_many",
    "caption": [
      {
        "t": "he",
        "v": "כַּמָּה חִפּוּשִׁיּוֹת?"
      }
    ]
  },
  "feedback": {
    "correct": {
      "vo": "vo:count.ladybugs.6.correct",
      "caption": [
        {
          "t": "he",
          "v": "שֵׁשׁ! סְפַרְתֶּם כׇּל אֶחָד פַּעַם אַחַת."
        }
      ]
    },
    "incorrect": [
      {
        "when": "misconception:M-CNT-DOUBLE",
        "vo": "vo:fb.double_set",
        "caption": [
          {
            "t": "he",
            "v": "אוּלַי סָפַרְנוּ אֶחָד פַּעֲמַיִם? בּוֹאוּ נִבְדֹּק."
          }
        ]
      },
      {
        "when": "misconception:M-CNT-SKIP",
        "vo": "vo:fb.skip_set",
        "caption": [
          {
            "t": "he",
            "v": "אוּלַי פִּסְפַּסְנוּ אֶחָד? בּוֹאוּ נִבְדֹּק."
          }
        ]
      },
      {
        "when": "default",
        "vo": "vo:fb.almost",
        "caption": [
          {
            "t": "he",
            "v": "כִּמְעַט! בּוֹאוּ נְנַסֶּה שׁוּב."
          }
        ]
      }
    ],
    "unsure": {
      "vo": "vo:fb.unsure",
      "caption": [
        {
          "t": "he",
          "v": "שְׁאֵלָה טוֹבָה! בּוֹאוּ נִרְאֶה יַחַד."
        }
      ]
    }
  },
  "hints": [
    {
      "level": 1,
      "action": "replay_prompt_slow",
      "vo": "vo:count.ladybugs.6.h1",
      "caption": [
        {
          "t": "he",
          "v": "נוֹגְעִים בְּחִפּוּשִׁית אֶחָד, וְאוֹמְרִים מִסְפָּר אֶחָד."
        }
      ]
    },
    {
      "level": 2,
      "action": "show_fingers",
      "vo": "vo:hint.ucount.h2",
      "caption": [
        {
          "t": "he",
          "v": "בּוֹאוּ נִסְפֹּר גַּם עִם הָאֶצְבָּעוֹת: אַחַת, שְׁתַּיִם, שָׁלוֹשׁ…"
        }
      ]
    },
    {
      "level": 3,
      "action": "worked_example",
      "vo": "vo:count.ladybugs.6.h3",
      "caption": [
        {
          "t": "he",
          "v": "אַחַת, שְׁתַּיִם, שָׁלוֹשׁ, אַרְבַּע, חָמֵשׁ, שֵׁשׁ. הַמִּסְפָּר הָאַחֲרוֹן אוֹמֵר כַּמָּה: שֵׁשׁ! עַכְשָׁו תּוֹרְכֶם — לִלְחֹץ עַל שֵׁשׁ."
        }
      ]
    }
  ],
  "scoring": {
    "maxAttempts": 3,
    "creditByHintLevel": [
      1,
      0.8,
      0.5,
      0
    ]
  },
  "tutor": {
    "llmAllowed": true,
    "goal": "child touches each one once and answers with the last number counted",
    "mustNotRevealBeforeHint": 3
  },
  "a11y": {
    "altText": "נוֹגְעִים בְּכׇל אֶחָד פַּעַם אַחַת, וְסוֹפְרִים."
  },
  "traceClassifiers": [
    {
      "when": "same_object_tapped_twice",
      "misconception": "M-CNT-DOUBLE"
    },
    {
      "when": "object_never_tapped",
      "misconception": "M-CNT-SKIP"
    }
  ]
}
